Comment ,Label,1_Comment,2_Comment,tokens,sent_tokens
Sơn Lâm đã đỉnh mà EAUT còn đỉnh hơn Học đại học - Học Đại Học Công Nghệ Đông Á,1,sơn lâm đã đỉnh mà eaut còn đỉnh hơn học đại học học đại học công nghệ đông á,sơn lâm đã đỉnh mà eaut còn đỉnh hơn học đại học học đại học công nghệ đông á,"['sơn', 'lâm', 'đã', 'đỉnh', 'mà', 'eaut', 'còn', 'đỉnh', 'hơn', 'học', 'đại_học', 'học', 'đại_học', 'công_nghệ', 'đông_á']",sơn lâm đã đỉnh mà eaut còn đỉnh hơn học đại_học học đại_học công_nghệ đông_á
Tự hào được làm việc và cống hiến một phần nhỏ vào trong những thành công của nhà trường!,1,tự hào được làm việc và cống hiến một phần nhỏ vào trong những thành công của nhà trường,tự hào được làm việc và cống hiến một phần nhỏ vào trong những thành công của nhà trường,"['tự_hào', 'được', 'làm_việc', 'và', 'cống_hiến', 'một', 'phần', 'nhỏ', 'vào', 'trong', 'những', 'thành_công', 'của', 'nhà_trường']",tự_hào được làm_việc và cống_hiến một phần nhỏ vào trong những thành_công của nhà_trường
Trường khang trang,1,trường khang trang,trường khang trang,"['trường', 'khang_trang']",trường khang_trang
Yêu trường quá nhỉ.,1,yêu trường quá nhỉ,yêu trường quá nhỉ,"['yêu', 'trường', 'quá', 'nhỉ']",yêu trường quá nhỉ
Sàn trơn quá vào đó ngày nào chắc cũng ngã liên tọi,0,sàn trơn quá vào đó ngày nào chắc cũng ngã liên tọi,sàn trơn quá vào đó ngày nào chắc cũng ngã liên tọi,"['sàn', 'trơn', 'quá', 'vào', 'đó', 'ngày', 'nào', 'chắc', 'cũng', 'ngã', 'liên', 'tọi']",sàn trơn quá vào đó ngày nào chắc cũng ngã liên tọi
share ngay cô ơi,1,share ngay cô ơi,share ngay cô ơi,"['share', 'ngay', 'cô', 'ơi']",share ngay cô ơi
Trường đầu tư quá =))),1,trường đầu tư quá,trường đầu tư quá,"['trường', 'đầu_tư', 'quá']",trường đầu_tư quá
tự hào kh em,1,tự hào kh em,tự hào kh em,"['tự_hào', 'kh', 'em']",tự_hào kh em
trường tôi xịn sò lắm,1,trường tôi xịn sò lắm,trường tôi xịn sò lắm,"['trường', 'tôi', 'xịn', 'sò', 'lắm']",trường tôi xịn sò lắm
góc làm việc này chill quá ^^,1,góc làm việc này chill quá,góc làm việc này chill quá,"['góc', 'làm_việc', 'này', 'chill', 'quá']",góc làm_việc này chill quá
Cute xỉuui,1,cute xỉuui,cute xỉuui,"['cute', 'xỉuui']",cute xỉuui
"Aaaa mê quá , chúng em cũng muốn ạ",1,aaaa mê quá chúng em cũng muốn ạ,aaaa mê quá chúng em cũng muốn ạ,"['aaaa', 'mê', 'quá', 'chúng', 'em', 'cũng', 'muốn', 'ạ']",aaaa mê quá chúng em cũng muốn ạ
Uầy sướng thế,1,uầy sướng thế,uầy sướng thế,"['uầy', 'sướng_thế']",uầy sướng_thế
Cute cá,1,cute cá,cute cá,"['cute', 'cá']",cute cá
Uầy xịn,1,uầy xịn,uầy xịn,"['uầy', 'xịn']",uầy xịn
Cute phết đấy,1,cute phết đấy,cute phết đấy,"['cute', 'phết', 'đấy']",cute phết đấy
xịn thế nhờ,1,xịn thế nhờ,xịn thế nhờ,"['xịn', 'thế', 'nhờ']",xịn thế nhờ
Xinh he,1,xinh he,xinh he,"['xinh', 'he']",xinh he
Đẹp quáaaaaaa,1,đẹp quáaaaaaa,đẹp quáaaaaaa,"['đẹp', 'quáaaaaaa']",đẹp quáaaaaaa
Các anh chị choáy quá nhờ,1,các anh chị choáy quá nhờ,các anh chị choáy quá nhờ,"['các', 'anh_chị', 'choáy', 'quá', 'nhờ']",các anh_chị choáy quá nhờ
Mk chỉ có thk kỉ niệm đại đại học công nghệ đông á thôi khoảng thời gian 4 năm đại học là đáng nhớ nhất,1,mk chỉ có thk kỉ niệm đại đại học công nghệ đông á thôi khoảng thời gian 4 năm đại học là đáng nhớ nhất,mk chỉ có thk kỉ niệm đại đại học công nghệ đông á thôi khoảng thời gian 4 năm đại học là đáng nhớ nhất,"['mk', 'chỉ', 'có', 'thk', 'kỉ_niệm', 'đại', 'đại_học', 'công_nghệ', 'đông', 'á', 'thôi', 'khoảng', 'thời_gian', '4', 'năm', 'đại_học', 'là', 'đáng', 'nhớ', 'nhất']",mk chỉ có thk kỉ_niệm đại đại_học công_nghệ đông á thôi khoảng thời_gian 4 năm đại_học là đáng nhớ nhất
Tuyệt vời quá!,1,tuyệt vời quá,tuyệt vời quá,"['tuyệt_vời', 'quá']",tuyệt_vời quá
Nhà trường rất chăm sóc sức khoẻ cho sinh viên (cụ thể là sinh viên k15),1,nhà trường rất chăm sóc sức khoẻ cho sinh viên cụ thể là sinh viên k15,nhà trường rất chăm sóc sức khoẻ cho sinh viên cụ thể là sinh viên k15,"['nhà_trường', 'rất', 'chăm_sóc', 'sức_khoẻ', 'cho', 'sinh_viên', 'cụ_thể', 'là', 'sinh_viên', 'k15']",nhà_trường rất chăm_sóc sức_khoẻ cho sinh_viên cụ_thể là sinh_viên k15
Khóa học rất ý nghĩa,1,khóa học rất ý nghĩa,khóa học rất ý nghĩa,"['khóa', 'học', 'rất', 'ý_nghĩa']",khóa học rất ý_nghĩa
chương trình hay quá,1,chương trình hay quá,chương trình hay quá,"['chương_trình', 'hay', 'quá']",chương_trình hay quá
Tuyệt vời quá con minh cũng học ở trường đại học công nghệ dông a,1,tuyệt vời quá con minh cũng học ở trường đại học công nghệ dông a,tuyệt vời quá con minh cũng học ở trường đại học công nghệ dông,"['tuyệt_vời', 'quá', 'con', 'minh', 'cũng', 'học', 'ở', 'trường', 'đại_học', 'công_nghệ_dông']",tuyệt_vời quá con minh cũng học ở trường đại_học công_nghệ_dông
"Thoáng mát,rộng rãi, nhà ăn sạch sẽ,đồ ăn ngon bổ rẻ, chỗ ở tiện nghi.",1,thoáng mátrộng rãi nhà ăn sạch sẽđồ ăn ngon bổ rẻ chỗ ở tiện nghi,thoáng mátrộng rãi nhà ăn sạch sẽđồ ăn ngon bổ rẻ chỗ ở tiện nghi,"['thoáng', 'mátrộng', 'rãi', 'nhà_ăn', 'sạch', 'sẽđồ', 'ăn', 'ngon', 'bổ', 'rẻ', 'chỗ', 'ở', 'tiện_nghi']",thoáng mátrộng rãi nhà_ăn sạch sẽđồ ăn ngon bổ rẻ chỗ ở tiện_nghi
Đẹp và vui,1,đẹp và vui,đẹp và vui,"['đẹp', 'và', 'vui']",đẹp và vui
Yên tĩnh,1,yên tĩnh,yên tĩnh,['yên_tĩnh'],yên_tĩnh
Bình thường,0,bình thường,bình thường,['bình_thường'],bình_thường
Vào đi các e ui trường TUYỆT lắm,1,vào đi các e ui trường tuyệt lắm,vào đi các e ui trường tuyệt lắm,"['vào', 'đi', 'các', 'e', 'ui', 'trường', 'tuyệt', 'lắm']",vào đi các e ui trường tuyệt lắm
Xịn,1,xịn,xịn,['xịn'],xịn
tuyệt vừi quá,1,tuyệt vừi quá,tuyệt vừi quá,"['tuyệt', 'vừi', 'quá']",tuyệt vừi quá
đi học toàn được đi thang máy thui nộp đi,1,đi học toàn được đi thang máy thui nộp đi,đi học toàn được đi thang máy thui nộp đi,"['đi', 'học', 'toàn', 'được', 'đi', 'thang_máy', 'thui', 'nộp', 'đi']",đi học toàn được đi thang_máy thui nộp đi
Trường xịn vậy,1,trường xịn vậy,trường xịn vậy,"['trường', 'xịn_vậy']",trường xịn_vậy
em yêu trường em,1,em yêu trường em,em yêu trường em,"['em', 'yêu', 'trường', 'em']",em yêu trường em
trường mình phần quảng cáo cứ phải gọi là đỉnh kout đấy còn thực thì,1,trường mình phần quảng cáo cứ phải gọi là đỉnh kout đấy còn thực thì,trường mình phần quảng cáo cứ phải gọi là đỉnh kout đấy còn thực thì,"['trường', 'mình', 'phần', 'quảng_cáo', 'cứ', 'phải', 'gọi', 'là', 'đỉnh', 'kout', 'đấy', 'còn', 'thực', 'thì']",trường mình phần quảng_cáo cứ phải gọi là đỉnh kout đấy còn thực thì
Vào EAUT ik trong đó nhìu tđ lém,1,vào eaut ik trong đó nhìu tđ lém,vào eaut ik trong đó nhìu tđ lém,"['vào', 'eaut', 'ik', 'trong', 'đó', 'nhìu', 'tđ', 'lém']",vào eaut ik trong đó nhìu tđ lém
Vào EAUT đi vào rồi muốn ra luôn =))),1,vào eaut đi vào rồi muốn ra luôn,vào eaut đi vào rồi muốn ra luôn,"['vào', 'eaut', 'đi', 'vào', 'rồi', 'muốn', 'ra', 'luôn']",vào eaut đi vào rồi muốn ra luôn
Bỏ HIC qua EAUT đây,1,bỏ hic qua eaut đây,bỏ hic qua eaut đây,"['bỏ', 'hic', 'qua', 'eaut', 'đây']",bỏ hic qua eaut đây
Vị trí dễ tìm kiếm quan cảnh rộng rãi thoáng mát,1,vị trí dễ tìm kiếm quan cảnh rộng rãi thoáng mát,vị trí dễ tìm kiếm quan cảnh rộng rãi thoáng mát,"['vị_trí', 'dễ', 'tìm_kiếm', 'quan', 'cảnh', 'rộng_rãi', 'thoáng', 'mát']",vị_trí dễ tìm_kiếm quan cảnh rộng_rãi thoáng mát
bãi giữ xe có bảo vệ,1,bãi giữ xe có bảo vệ,bãi giữ xe có bảo vệ,"['bãi', 'giữ', 'xe', 'có', 'bảo_vệ']",bãi giữ xe có bảo_vệ
giảng viên tận tình chu đáo và rất có tâm,1,giảng viên tận tình chu đáo và rất có tâm,giảng viên tận tình chu đáo và rất có tâm,"['giảng_viên', 'tận_tình', 'chu_đáo', 'và', 'rất', 'có', 'tâm']",giảng_viên tận_tình chu_đáo và rất có tâm
trường có bộ phận tư vấn chưa được tốt.,0,trường có bộ phận tư vấn chưa được tốt,trường có bộ phận tư vấn chưa được tốt,"['trường', 'có', 'bộ_phận', 'tư_vấn', 'chưa', 'được', 'tốt']",trường có bộ_phận tư_vấn chưa được tốt
Học phí hơi cao,0,học phí hơi cao,học phí hơi cao,"['học_phí', 'hơi', 'cao']",học_phí hơi cao
Thi trượt rồi buồn quá,0,thi trượt rồi buồn quá,thi trượt rồi buồn quá,"['thi', 'trượt', 'rồi', 'buồn', 'quá']",thi trượt rồi buồn quá
"Sinh viên đã bỏ tiền mua nước và sử dụng dịch vụ, thanh toán đầy đủ nhưng lại phải nhận nguồn nước và nhà vệ sinh DƠ như vậy",0,sinh viên đã bỏ tiền mua nước và sử dụng dịch vụ thanh toán đầy đủ nhưng lại phải nhận nguồn nước và nhà vệ sinh dơ như vậy,sinh viên đã bỏ tiền mua nước và sử dụng dịch vụ thanh toán đầy đủ nhưng lại phải nhận nguồn nước và nhà vệ sinh dơ như vậy,"['sinh_viên', 'đã', 'bỏ', 'tiền', 'mua', 'nước', 'và', 'sử_dụng', 'dịch_vụ', 'thanh_toán', 'đầy_đủ', 'nhưng', 'lại', 'phải', 'nhận', 'nguồn', 'nước', 'và', 'nhà', 'vệ_sinh', 'dơ', 'như_vậy']",sinh_viên đã bỏ tiền mua nước và sử_dụng dịch_vụ thanh_toán đầy_đủ nhưng lại phải nhận nguồn nước và nhà vệ_sinh dơ như_vậy
Học phí tiền quá,0,học phí tiền quá,học phí tiền quá,"['học_phí', 'tiền', 'quá']",học_phí tiền quá
Giảng viên không có chuyên môn,0,giảng viên không có chuyên môn,giảng viên không có chuyên môn,"['giảng_viên', 'không', 'có', 'chuyên_môn']",giảng_viên không có chuyên_môn
Cơ sở vật chất không xứng đáng với số tiền bỏ ra,0,cơ sở vật chất không xứng đáng với số tiền bỏ ra,cơ sở vật chất không xứng đáng với số tiền bỏ ra,"['cơ_sở', 'vật_chất', 'không', 'xứng_đáng', 'với', 'số', 'tiền', 'bỏ', 'ra']",cơ_sở vật_chất không xứng_đáng với số tiền bỏ ra
Chọn trường khác đi các em,0,chọn trường khác đi các em,chọn trường khác đi các em,"['chọn', 'trường', 'khác', 'đi', 'các', 'em']",chọn trường khác đi các em
Thà học cao đẳng fpt bên cạnh còn hơn 🤡 tôi com bat vs công tác sinh viên bỏ hẳn nên không sợ nữa,0,thà học cao đẳng fpt bên cạnh còn hơn tôi com bat vs công tác sinh viên bỏ hẳn nên không sợ nữa,thà học cao đẳng fpt bên cạnh còn hơn tôi com bat vs công tác sinh viên bỏ hẳn nên không sợ nữa,"['thà', 'học', 'cao_đẳng', 'fpt', 'bên', 'cạnh', 'còn', 'hơn', 'tôi', 'com', 'bat', 'vs', 'công_tác', 'sinh_viên', 'bỏ', 'hẳn', 'nên', 'không', 'sợ', 'nữa']",thà học cao_đẳng fpt bên cạnh còn hơn tôi com bat vs công_tác sinh_viên bỏ hẳn nên không sợ nữa
Tốt nhất là đừng nên vào 🙂,0,tốt nhất là đừng nên vào,tốt nhất là đừng nên vào,"['tốt', 'nhất', 'là', 'đừng', 'nên', 'vào']",tốt nhất là đừng nên vào
Thà học FPoly ngay cạnh còn hơn 🤡,0,thà học fpoly ngay cạnh còn hơn,thà học fpoly ngay cạnh còn hơn,"['thà', 'học', 'fpoly', 'ngay', 'cạnh', 'còn', 'hơn']",thà học fpoly ngay cạnh còn hơn
học nghề còn ngon hơn,0,học nghề còn ngon hơn,học nghề còn ngon hơn,"['học', 'nghề', 'còn', 'ngon', 'hơn']",học nghề còn ngon hơn
Chạy đi các cháu ôi,0,chạy đi các cháu ôi,chạy đi các cháu ôi,"['chạy', 'đi', 'các', 'cháu', 'ôi']",chạy đi các cháu ôi
Quay đầu là bờ🙂,0,quay đầu là bờ,quay đầu là bờ,"['quay', 'đầu', 'là', 'bờ']",quay đầu là bờ
Học cho vui lấy bằng ra làm làm moblie này,0,học cho vui lấy bằng ra làm làm moblie này,học cho vui lấy bằng ra làm làm moblie này,"['học', 'cho', 'vui', 'lấy', 'bằng', 'ra', 'làm', 'làm', 'moblie', 'này']",học cho vui lấy bằng ra làm làm moblie này
đi xuống tí nữa học fpl:)),0,đi xuống tí nữa học fpl,đi xuống tí nữa học fpl,"['đi', 'xuống', 'tí', 'nữa', 'học', 'fpl']",đi xuống tí nữa học fpl
Vào phenikaa đi nha e,0,vào phenikaa đi nha e,vào phenikaa đi nha e,"['vào', 'phenikaa', 'đi', 'nha_e']",vào phenikaa đi nha_e
Gãy lắm em ơi,0,gãy lắm em ơi,gãy lắm em ơi,"['gãy', 'lắm', 'em', 'ơi']",gãy lắm em ơi
"Thầy cô thân thiện, học sinh hoà đồng không lo rớt môn:))",1,thầy cô thân thiện học sinh hoà đồng không lo rớt môn,thầy cô thân thiện học sinh hoà đồng không lo rớt môn,"['thầy_cô', 'thân_thiện', 'học_sinh', 'hoà_đồng', 'không', 'lo', 'rớt', 'môn']",thầy_cô thân_thiện học_sinh hoà_đồng không lo rớt môn
trường này cute lắm ỏ 😘😘😘,1,trường này cute lắm ỏ,trường này cute lắm ỏ,"['trường', 'này', 'cute', 'lắm', 'ỏ']",trường này cute lắm ỏ
chê ☺️,0,chê,chê,['chê'],chê
Như cằc nhé😍,0,như cằc nhé,như cằc nhé,"['như', 'cằc', 'nhé']",như cằc nhé
quay đầu đi e:)),0,quay đầu đi e,quay đầu đi e,"['quay', 'đầu', 'đi', 'e']",quay đầu đi e
"Đừng học:"")))",0,đừng học,đừng học,"['đừng', 'học']",đừng học
Trường l,0,trường l,trường,['trường'],trường
Truong lon ❤️,0,truong lon,truong lon,"['truong', 'lon']",truong lon
"học ok nhá , lịch học với thi các kiểu ô kê lứm nè, gái xinh siu nhieuu😋",1,học ok nhá lịch học với thi các kiểu ô kê lứm nè gái xinh siu nhieuu,học ok nhá lịch học với thi các kiểu kê lứm nè gái xinh siu nhieuu,"['học', 'ok', 'nhá', 'lịch', 'học', 'với', 'thi', 'các', 'kiểu', 'kê', 'lứm', 'nè', 'gái', 'xinh', 'siu', 'nhieuu']",học ok nhá lịch học với thi các kiểu kê lứm nè gái xinh siu nhieuu
"Trường chất lượng đào tạo được, cơ sở vật chất tốt, thầy cô nhiệt tình, tóm lại là rất tuyệt.",1,trường chất lượng đào tạo được cơ sở vật chất tốt thầy cô nhiệt tình tóm lại là rất tuyệt,trường chất lượng đào tạo được cơ sở vật chất tốt thầy cô nhiệt tình tóm lại là rất tuyệt,"['trường', 'chất_lượng', 'đào_tạo', 'được', 'cơ_sở', 'vật_chất', 'tốt', 'thầy_cô', 'nhiệt_tình', 'tóm', 'lại', 'là', 'rất', 'tuyệt']",trường chất_lượng đào_tạo được cơ_sở vật_chất tốt thầy_cô nhiệt_tình tóm lại là rất tuyệt
như cứt đừng vào,0,như cứt đừng vào,như cứt đừng vào,"['như', 'cứt', 'đừng', 'vào']",như cứt đừng vào
Chạy ngay đi,0,chạy ngay đi,chạy ngay đi,"['chạy', 'ngay', 'đi']",chạy ngay đi
"Máy lạnh everywhere và đặc biệt chất lượng giảng dạy, thầy cô, csvc phải gọi số dách 🫶",1,máy lạnh everywhere và đặc biệt chất lượng giảng dạy thầy cô csvc phải gọi số dách,máy lạnh everywhere và đặc biệt chất lượng giảng dạy thầy cô csvc phải gọi số dách,"['máy_lạnh', 'everywhere', 'và', 'đặc_biệt', 'chất_lượng', 'giảng_dạy', 'thầy_cô', 'csvc', 'phải', 'gọi', 'số', 'dách']",máy_lạnh everywhere và đặc_biệt chất_lượng giảng_dạy thầy_cô csvc phải gọi số dách
Ước out,0,ước out,ước out,"['ước', 'out']",ước out
Canteen trường hồi trước có bán bánh mỳ ngon lắm mà giờ dẹp luôn cái canteen,1,canteen trường hồi trước có bán bánh mỳ ngon lắm mà giờ dẹp luôn cái canteen,canteen trường hồi trước có bán bánh mỳ ngon lắm mà giờ dẹp luôn cái canteen,"['canteen', 'trường', 'hồi', 'trước', 'có', 'bán', 'bánh', 'mỳ', 'ngon', 'lắm', 'mà', 'giờ', 'dẹp', 'luôn', 'cái', 'canteen']",canteen trường hồi trước có bán bánh mỳ ngon lắm mà giờ dẹp luôn cái canteen
"Tốt nhất đừng nên vô,sợ sau này ra hong dám chổ nào nhận",1,tốt nhất đừng nên vôsợ sau này ra hong dám chổ nào nhận,tốt nhất đừng nên vôsợ sau này ra hong dám chổ nào nhận,"['tốt', 'nhất', 'đừng', 'nên', 'vôsợ', 'sau_này', 'ra', 'hong', 'dám', 'chổ', 'nào', 'nhận']",tốt nhất đừng nên vôsợ sau_này ra hong dám chổ nào nhận
Mãi anti trường 😾,0,mãi anti trường,mãi anti trường,"['mãi', 'anti', 'trường']",mãi anti trường
nếu được chọn lại vẫn chọn EAUT,1,nếu được chọn lại vẫn chọn eaut,nếu được chọn lại vẫn chọn eaut,"['nếu', 'được', 'chọn', 'lại', 'vẫn', 'chọn', 'eaut']",nếu được chọn lại vẫn chọn eaut
giảng viên hơi ba chấm,0,giảng viên hơi ba chấm,giảng viên hơi ba chấm,"['giảng_viên', 'hơi', 'ba', 'chấm']",giảng_viên hơi ba chấm
ko hẹn ngày ra trường :)),0,ko hẹn ngày ra trường,ko hẹn ngày ra trường,"['ko', 'hẹn', 'ngày', 'ra', 'trường']",ko hẹn ngày ra trường
"CSVC rất tốt, trường khá rộng và khuôn viên có rất nhiều cây xanh, phòng học nào cũng có máy lạnh và màn hình chiếu, các không gian tự học đủ mọi hình thức từ bàn ghế đá ngoài sân",1,csvc rất tốt trường khá rộng và khuôn viên có rất nhiều cây xanh phòng học nào cũng có máy lạnh và màn hình chiếu các không gian tự học đủ mọi hình thức từ bàn ghế đá ngoài sân,csvc rất tốt trường khá rộng và khuôn viên có rất nhiều cây xanh phòng học nào cũng có máy lạnh và màn hình chiếu các không gian tự học đủ mọi hình thức từ bàn ghế đá ngoài sân,"['csvc', 'rất', 'tốt', 'trường', 'khá', 'rộng', 'và', 'khuôn_viên', 'có', 'rất', 'nhiều', 'cây_xanh', 'phòng', 'học', 'nào', 'cũng', 'có', 'máy_lạnh', 'và', 'màn_hình_chiếu', 'các', 'không_gian', 'tự', 'học', 'đủ', 'mọi', 'hình_thức', 'từ', 'bàn', 'ghế', 'đá', 'ngoài', 'sân']",csvc rất tốt trường khá rộng và khuôn_viên có rất nhiều cây_xanh phòng học nào cũng có máy_lạnh và màn_hình_chiếu các không_gian tự học đủ mọi hình_thức từ bàn ghế đá ngoài sân
"Phòng học lạnh lắm, lạnh như số tiền học phí 🥲",0,phòng học lạnh lắm lạnh như số tiền học phí,phòng học lạnh lắm lạnh như số tiền học phí,"['phòng', 'học', 'lạnh', 'lắm', 'lạnh', 'như', 'số', 'tiền', 'học_phí']",phòng học lạnh lắm lạnh như số tiền học_phí
"Trường rất tuyệt vời, có lúc ko tuyệt lắm = ))",1,trường rất tuyệt vời có lúc ko tuyệt lắm,trường rất tuyệt vời có lúc ko tuyệt lắm,"['trường', 'rất', 'tuyệt_vời', 'có', 'lúc', 'ko', 'tuyệt', 'lắm']",trường rất tuyệt_vời có lúc ko tuyệt lắm
Bạn toii 5 đứa học là 5 đứa chửi trường...,0,bạn toii 5 đứa học là 5 đứa chửi trường,bạn toii 5 đứa học là 5 đứa chửi trường,"['bạn', 'toii', '5', 'đứa', 'học', 'là', '5', 'đứa', 'chửi', 'trường']",bạn toii 5 đứa học là 5 đứa chửi trường
"Thầy cô dạy ok, quan trọng là có đủ tầm để hiểu hay không.",1,thầy cô dạy ok quan trọng là có đủ tầm để hiểu hay không,thầy cô dạy ok quan trọng là có đủ tầm để hiểu hay không,"['thầy_cô', 'dạy', 'ok', 'quan_trọng', 'là', 'có', 'đủ', 'tầm', 'để', 'hiểu', 'hay', 'không']",thầy_cô dạy ok quan_trọng là có đủ tầm để hiểu hay không
"nhiều thầy dễ thương, dạy toán tiếng anh xong làm em phải học lại tận 2 lần 🐧",0,nhiều thầy dễ thương dạy toán tiếng anh xong làm em phải học lại tận 2 lần,nhiều thầy dễ thương dạy toán tiếng anh xong làm em phải học lại tận 2 lần,"['nhiều', 'thầy', 'dễ_thương', 'dạy', 'toán', 'tiếng', 'anh', 'xong', 'làm', 'em', 'phải', 'học', 'lại', 'tận', '2', 'lần']",nhiều thầy dễ_thương dạy toán tiếng anh xong làm em phải học lại tận 2 lần
Cũng ngon vừa nêm 🙂,1,cũng ngon vừa nêm,cũng ngon vừa nêm,"['cũng', 'ngon', 'vừa', 'nêm']",cũng ngon vừa nêm
Nhieu ban nu xjnk lam,1,nhieu ban nu xjnk lam,nhieu ban nu xjnk lam,"['nhieu', 'ban', 'nu', 'xjnk', 'lam']",nhieu ban nu xjnk lam
Trường cũng có lắng nghe sinh viên. Còn thay đổi hay không thì cũng tùy cái thôi :>>,1,trường cũng có lắng nghe sinh viên còn thay đổi hay không thì cũng tùy cái thôi,trường cũng có lắng nghe sinh viên còn thay đổi hay không thì cũng tùy cái thôi,"['trường', 'cũng', 'có', 'lắng_nghe', 'sinh_viên', 'còn', 'thay_đổi', 'hay', 'không', 'thì', 'cũng', 'tùy', 'cái', 'thôi']",trường cũng có lắng_nghe sinh_viên còn thay_đổi hay không thì cũng tùy cái thôi
Học cũng nhẹ đầu nặng mỗi tiền học lại thui hoho,0,học cũng nhẹ đầu nặng mỗi tiền học lại thui hoho,học cũng nhẹ đầu nặng mỗi tiền học lại thui hoho,"['học', 'cũng', 'nhẹ', 'đầu', 'nặng', 'mỗi', 'tiền', 'học', 'lại', 'thui', 'hoho']",học cũng nhẹ đầu nặng mỗi tiền học lại thui hoho
"Học siêu nhàn luôn nha, học xong buổi thì cứ xách giày đi đá banh, đi cháy phố, chiến game,... cứ như thế tới cuối kỳ là lụm full A, A+",1,học siêu nhàn luôn nha học xong buổi thì cứ xách giày đi đá banh đi cháy phố chiến game cứ như thế tới cuối kỳ là lụm full a a,học siêu nhàn luôn nha học xong buổi thì cứ xách giày đi đá banh đi cháy phố chiến game cứ như thế tới cuối kỳ là lụm full,"['học', 'siêu', 'nhàn', 'luôn', 'nha', 'học', 'xong', 'buổi', 'thì', 'cứ', 'xách', 'giày', 'đi', 'đá', 'banh', 'đi', 'cháy', 'phố', 'chiến', 'game', 'cứ', 'như', 'thế', 'tới', 'cuối', 'kỳ', 'là', 'lụm', 'full']",học siêu nhàn luôn nha học xong buổi thì cứ xách giày đi đá banh đi cháy phố chiến game cứ như thế tới cuối kỳ là lụm full
"thầy cô xịn, môi trường cũng ok, cũng nhiều hoạt động nè em :)))",1,thầy cô xịn môi trường cũng ok cũng nhiều hoạt động nè em,thầy cô xịn môi trường cũng ok cũng nhiều hoạt động nè em,"['thầy_cô', 'xịn', 'môi_trường', 'cũng', 'ok', 'cũng', 'nhiều', 'hoạt_động', 'nè', 'em']",thầy_cô xịn môi_trường cũng ok cũng nhiều hoạt_động nè em
"Lên gg search học phí đi, bán chục con trâu chưa chắc đã đủ tiền cho bò đi học",0,lên gg search học phí đi bán chục con trâu chưa chắc đã đủ tiền cho bò đi học,lên gg search học phí đi bán chục con trâu chưa chắc đã đủ tiền cho bò đi học,"['lên', 'gg', 'search', 'học_phí', 'đi', 'bán', 'chục', 'con', 'trâu', 'chưa', 'chắc', 'đã', 'đủ', 'tiền', 'cho', 'bò', 'đi', 'học']",lên gg search học_phí đi bán chục con trâu chưa chắc đã đủ tiền cho bò đi học
10 điểm,1,10 điểm,10 điểm,"['10', 'điểm']",10 điểm
ghee that nha,1,ghee that nha,ghee that nha,"['ghee', 'that', 'nha']",ghee that nha
Độc lạ quá các thầy cô ạ,1,độc lạ quá các thầy cô ạ,độc lạ quá các thầy cô ạ,"['độc', 'lạ', 'quá', 'các', 'thầy_cô', 'ạ']",độc lạ quá các thầy_cô ạ
100/100,1,100100,100100,['100100'],100100
10đ đangiuu ạaaaa,1,10đ đangiuu ạaaaa,10đ đangiuu ạaaaa,"['10đ', 'đangiuu', 'ạaaaa']",10đ đangiuu ạaaaa
