Comment ,Label,1_Comment,2_Comment,tokens,sent_tokens
"Nhà trường sắp xếp lịch thi cho hệ từ xa không phù hợp toàn sắp xếp thời gian ban đêm. Những bạn ở xa ngoại thành thi về rất trễ qua hôm qua lại đi làm. Khi hỏi đến nhờ tư vấn elosupport thì trả lời như không trả lời , trả lời một cách rất qua loa cho xong việc . Tư vấn viên thì tỏ hẳn thái độ khi được nhờ giải quyết . Nói chung thái độ và cách sắp xếp thời gian thi rất rất không được",0,nhà trường sắp xếp lịch thi cho hệ từ xa không phù hợp toàn sắp xếp thời gian ban đêm những bạn ở xa ngoại thành thi về rất trễ qua hôm qua lại đi làm khi hỏi đến nhờ tư vấn elosupport thì trả lời như không trả lời trả lời một cách rất qua loa cho xong việc tư vấn viên thì tỏ hẳn thái độ khi được nhờ giải quyết nói chung thái độ và cách sắp xếp thời gian thi rất rất không được,nhà trường sắp xếp lịch thi cho hệ từ xa không phù hợp toàn sắp xếp thời gian ban đêm những bạn ở xa ngoại thành thi về rất trễ qua hôm qua lại đi làm khi hỏi đến nhờ tư vấn elosupport thì trả lời như không trả lời trả lời một cách rất qua loa cho xong việc tư vấn viên thì tỏ hẳn thái độ khi được nhờ giải quyết nói chung thái độ và cách sắp xếp thời gian thi rất rất không được,"['nhà_trường', 'sắp_xếp', 'lịch', 'thi', 'cho', 'hệ_từ', 'xa', 'không', 'phù_hợp', 'toàn', 'sắp_xếp', 'thời_gian', 'ban_đêm', 'những', 'bạn', 'ở', 'xa', 'ngoại_thành', 'thi', 'về', 'rất', 'trễ', 'qua', 'hôm_qua_lại', 'đi', 'làm', 'khi', 'hỏi', 'đến', 'nhờ', 'tư_vấn', 'elosupport', 'thì', 'trả_lời', 'như_không', 'trả_lời', 'trả_lời', 'một_cách', 'rất', 'qua_loa', 'cho', 'xong', 'việc', 'tư_vấn', 'viên', 'thì', 'tỏ', 'hẳn', 'thái_độ', 'khi', 'được', 'nhờ', 'giải_quyết', 'nói_chung', 'thái_độ', 'và', 'cách', 'sắp_xếp', 'thời_gian', 'thi', 'rất', 'rất', 'không', 'được']",nhà_trường sắp_xếp lịch thi cho hệ_từ xa không phù_hợp toàn sắp_xếp thời_gian ban_đêm những bạn ở xa ngoại_thành thi về rất trễ qua hôm_qua_lại đi làm khi hỏi đến nhờ tư_vấn elosupport thì trả_lời như_không trả_lời trả_lời một_cách rất qua_loa cho xong việc tư_vấn viên thì tỏ hẳn thái_độ khi được nhờ giải_quyết nói_chung thái_độ và cách sắp_xếp thời_gian thi rất rất không được
"Giữ xe ở MTL thì thái độ vô học, chất lượng đào tạo thì kém, phòng QLDT quá kém, thái độ trịch thượng, ai vào rồi sẽ hối hận ko kịp, mẹ, đa số đánh giá 5s ở đây đều là bọn nó thuê máy chạy để nâng sao lên, đừng làm cái trò bẩn thỉu vậy nhé.",0,giữ xe ở mtl thì thái độ vô học chất lượng đào tạo thì kém phòng qldt quá kém thái độ trịch thượng ai vào rồi sẽ hối hận ko kịp mẹ đa số đánh giá 5s ở đây đều là bọn nó thuê máy chạy để nâng sao lên đừng làm cái trò bẩn thỉu vậy nhé,giữ xe ở mtl thì thái độ vô học chất lượng đào tạo thì kém phòng qldt quá kém thái độ trịch thượng ai vào rồi sẽ hối hận ko kịp mẹ đa số đánh giá 5s ở đây đều là bọn nó thuê máy chạy để nâng sao lên đừng làm cái trò bẩn thỉu vậy nhé,"['giữ', 'xe', 'ở', 'mtl', 'thì', 'thái_độ', 'vô_học', 'chất_lượng', 'đào_tạo', 'thì', 'kém', 'phòng', 'qldt', 'quá', 'kém', 'thái_độ', 'trịch_thượng', 'ai', 'vào', 'rồi', 'sẽ', 'hối_hận', 'ko', 'kịp', 'mẹ', 'đa_số', 'đánh_giá', '5s', 'ở', 'đây', 'đều', 'là', 'bọn', 'nó', 'thuê', 'máy', 'chạy', 'để', 'nâng', 'sao', 'lên', 'đừng', 'làm', 'cái_trò', 'bẩn_thỉu', 'vậy', 'nhé']",giữ xe ở mtl thì thái_độ vô_học chất_lượng đào_tạo thì kém phòng qldt quá kém thái_độ trịch_thượng ai vào rồi sẽ hối_hận ko kịp mẹ đa_số đánh_giá 5s ở đây đều là bọn nó thuê máy chạy để nâng sao lên đừng làm cái_trò bẩn_thỉu vậy nhé
Chưa bao giờ hối hận khi là sinh viên của trường ❤️,1,chưa bao giờ hối hận khi là sinh viên của trường,chưa bao giờ hối hận khi là sinh viên của trường,"['chưa', 'bao_giờ', 'hối_hận', 'khi', 'là', 'sinh_viên', 'của', 'trường']",chưa bao_giờ hối_hận khi là sinh_viên của trường
"Đôi lúc không tìm thấy thứ ta cần, nhưng nhìn chung vẫn ok nên 4 sao nhé!!",1,đôi lúc không tìm thấy thứ ta cần nhưng nhìn chung vẫn ok nên 4 sao nhé,đôi lúc không tìm thấy thứ ta cần nhưng nhìn chung vẫn ok nên 4 sao nhé,"['đôi', 'lúc', 'không', 'tìm', 'thấy', 'thứ', 'ta', 'cần', 'nhưng', 'nhìn_chung', 'vẫn', 'ok', 'nên', '4', 'sao', 'nhé']",đôi lúc không tìm thấy thứ ta cần nhưng nhìn_chung vẫn ok nên 4 sao nhé
Nen can nhac khi chon,0,nen can nhac khi chon,nen can nhac khi chon,"['nen', 'can', 'nhac', 'khi', 'chon']",nen can nhac khi chon
Học chương trình liên kết mà cơ sở vật chất rởm. Bàn ghế như cấp 3 không có tựa lưng ghế. Máy lạnh phòng 40 người vẫn nóng hừng hực như lò bát quái. Mạng thì chập chờn.,0,học chương trình liên kết mà cơ sở vật chất rởm bàn ghế như cấp 3 không có tựa lưng ghế máy lạnh phòng 40 người vẫn nóng hừng hực như lò bát quái mạng thì chập chờn,học chương trình liên kết mà cơ sở vật chất rởm bàn ghế như cấp 3 không có tựa lưng ghế máy lạnh phòng 40 người vẫn nóng hừng hực như lò bát quái mạng thì chập chờn,"['học', 'chương_trình', 'liên_kết', 'mà', 'cơ_sở', 'vật_chất', 'rởm', 'bàn', 'ghế', 'như', 'cấp', '3', 'không', 'có', 'tựa', 'lưng', 'ghế', 'máy_lạnh', 'phòng', '40', 'người', 'vẫn', 'nóng', 'hừng_hực', 'như', 'lò', 'bát_quái', 'mạng', 'thì', 'chập_chờn']",học chương_trình liên_kết mà cơ_sở vật_chất rởm bàn ghế như cấp 3 không có tựa lưng ghế máy_lạnh phòng 40 người vẫn nóng hừng_hực như lò bát_quái mạng thì chập_chờn
"1. Trường nên xem lại việc thu tiền của học viên; 2. Nhận học viên thì đừng nhận để kiếm tiền, đừng đưa học viên đăng ký học vb2 vô lớp vb1 rồi để học viên tự đăng ký môn học để tốt nghiệp; 3. Trường giống ..... à thôi.",0,1 trường nên xem lại việc thu tiền của học viên 2 nhận học viên thì đừng nhận để kiếm tiền đừng đưa học viên đăng ký học vb2 vô lớp vb1 rồi để học viên tự đăng ký môn học để tốt nghiệp 3 trường giống à thôi,1 trường nên xem lại việc thu tiền của học viên 2 nhận học viên thì đừng nhận để kiếm tiền đừng đưa học viên đăng ký học vb2 vô lớp vb1 rồi để học viên tự đăng ký môn học để tốt nghiệp 3 trường giống à thôi,"['1', 'trường', 'nên', 'xem_lại', 'việc', 'thu', 'tiền', 'của', 'học_viên', '2', 'nhận', 'học_viên', 'thì', 'đừng', 'nhận', 'để', 'kiếm', 'tiền', 'đừng', 'đưa', 'học_viên', 'đăng_ký', 'học', 'vb2', 'vô', 'lớp', 'vb1', 'rồi', 'để', 'học_viên', 'tự', 'đăng_ký', 'môn_học', 'để', 'tốt_nghiệp', '3', 'trường', 'giống', 'à', 'thôi']",1 trường nên xem_lại việc thu tiền của học_viên 2 nhận học_viên thì đừng nhận để kiếm tiền đừng đưa học_viên đăng_ký học vb2 vô lớp vb1 rồi để học_viên tự đăng_ký môn_học để tốt_nghiệp 3 trường giống à thôi
Trường này không có đào tạo hình thức vừa làm vừa học ngành cấp thoát nước ở an giang nhưng vẫn thông báo nhận hồ sơ và thu lệ phí xét tuyển,0,trường này không có đào tạo hình thức vừa làm vừa học ngành cấp thoát nước ở an giang nhưng vẫn thông báo nhận hồ sơ và thu lệ phí xét tuyển,trường này không có đào tạo hình thức vừa làm vừa học ngành cấp thoát nước ở an giang nhưng vẫn thông báo nhận hồ sơ và thu lệ phí xét tuyển,"['trường', 'này', 'không', 'có', 'đào_tạo', 'hình_thức', 'vừa', 'làm', 'vừa', 'học', 'ngành', 'cấp', 'thoát', 'nước', 'ở', 'an', 'giang', 'nhưng', 'vẫn', 'thông_báo', 'nhận', 'hồ_sơ', 'và', 'thu', 'lệ_phí', 'xét', 'tuyển']",trường này không có đào_tạo hình_thức vừa làm vừa học ngành cấp thoát nước ở an giang nhưng vẫn thông_báo nhận hồ_sơ và thu lệ_phí xét tuyển
"Ngôi trường khang trang,trang thiết bị tốt, có cả máy lạnh",1,ngôi trường khang trangtrang thiết bị tốt có cả máy lạnh,ngôi trường khang trangtrang thiết bị tốt có cả máy lạnh,"['ngôi', 'trường', 'khang', 'trangtrang', 'thiết_bị', 'tốt', 'có', 'cả', 'máy_lạnh']",ngôi trường khang trangtrang thiết_bị tốt có cả máy_lạnh
Sạch sẽ nhân viên vệ sinh ok,1,sạch sẽ nhân viên vệ sinh ok,sạch sẽ nhân viên vệ sinh ok,"['sạch_sẽ', 'nhân_viên', 'vệ_sinh', 'ok']",sạch_sẽ nhân_viên vệ_sinh ok
Trường gì mà học phí cao mà cứ dí đóng học phí phải nhanh còn lúc chuyển tiền lại cho sv thì chậm chạp làm ăn lề mề. Cho 1 sao luôn trường gì thiếu chuyên nghiệp hết sức,0,trường gì mà học phí cao mà cứ dí đóng học phí phải nhanh còn lúc chuyển tiền lại cho sv thì chậm chạp làm ăn lề mề cho 1 sao luôn trường gì thiếu chuyên nghiệp hết sức,trường gì mà học phí cao mà cứ dí đóng học phí phải nhanh còn lúc chuyển tiền lại cho sv thì chậm chạp làm ăn lề mề cho 1 sao luôn trường gì thiếu chuyên nghiệp hết sức,"['trường', 'gì', 'mà', 'học_phí', 'cao', 'mà', 'cứ', 'dí', 'đóng', 'học_phí', 'phải', 'nhanh', 'còn', 'lúc', 'chuyển', 'tiền', 'lại', 'cho', 'sv', 'thì', 'chậm_chạp', 'làm_ăn', 'lề_mề', 'cho', '1', 'sao', 'luôn', 'trường', 'gì', 'thiếu', 'chuyên_nghiệp', 'hết_sức']",trường gì mà học_phí cao mà cứ dí đóng học_phí phải nhanh còn lúc chuyển tiền lại cho sv thì chậm_chạp làm_ăn lề_mề cho 1 sao luôn trường gì thiếu chuyên_nghiệp hết_sức
"đến từ 8h kém để nhận bằng
họ hẹn hơn 8h sẽ có nhân viên phụ trách tới phát bằng
8h rưỡi quay lại thì người đó vẫn chưa tới
đợi đến 9h 15 người đó tới
kéo theo cả đám người quan hệ cocc kiểu gì
chen ngang ko bốc số ko xếp hàng gì
chơi trên đầu trên cổ người ta
trường to đẹp như vậy
mà chỉ 1 người có khả năng đưa bằng
người đó tới trễ gọi ko nge máy là coi như trường ko làm được gì cả",0,đến từ 8h kém để nhận bằng họ hẹn hơn 8h sẽ có nhân viên phụ trách tới phát bằng 8h rưỡi quay lại thì người đó vẫn chưa tới đợi đến 9h 15 người đó tới kéo theo cả đám người quan hệ cocc kiểu gì chen ngang ko bốc số ko xếp hàng gì chơi trên đầu trên cổ người ta trường to đẹp như vậy mà chỉ 1 người có khả năng đưa bằng người đó tới trễ gọi ko nge máy là coi như trường ko làm được gì cả,đến từ 8h kém để nhận bằng họ hẹn hơn 8h sẽ có nhân viên phụ trách tới phát bằng 8h rưỡi quay lại thì người đó vẫn chưa tới đợi đến 9h 15 người đó tới kéo theo cả đám người quan hệ cocc kiểu gì chen ngang ko bốc số ko xếp hàng gì chơi trên đầu trên cổ người ta trường to đẹp như vậy mà chỉ 1 người có khả năng đưa bằng người đó tới trễ gọi ko nge máy là coi như trường ko làm được gì cả,"['đến', 'từ', '8h', 'kém', 'để', 'nhận', 'bằng', 'họ', 'hẹn', 'hơn', '8h', 'sẽ', 'có_nhân_viên', 'phụ_trách', 'tới', 'phát', 'bằng', '8h', 'rưỡi', 'quay', 'lại', 'thì', 'người', 'đó', 'vẫn', 'chưa', 'tới', 'đợi', 'đến', '9h', '15', 'người', 'đó', 'tới', 'kéo_theo', 'cả', 'đám', 'người', 'quan_hệ', 'cocc', 'kiểu', 'gì', 'chen', 'ngang', 'ko', 'bốc', 'số', 'ko', 'xếp_hàng', 'gì', 'chơi', 'trên', 'đầu', 'trên', 'cổ', 'người_ta', 'trường', 'to', 'đẹp', 'như', 'vậy_mà', 'chỉ', '1', 'người', 'có', 'khả_năng', 'đưa', 'bằng', 'người', 'đó', 'tới', 'trễ', 'gọi', 'ko', 'nge', 'máy', 'là', 'coi', 'như', 'trường', 'ko', 'làm', 'được', 'gì', 'cả']",đến từ 8h kém để nhận bằng họ hẹn hơn 8h sẽ có_nhân_viên phụ_trách tới phát bằng 8h rưỡi quay lại thì người đó vẫn chưa tới đợi đến 9h 15 người đó tới kéo_theo cả đám người quan_hệ cocc kiểu gì chen ngang ko bốc số ko xếp_hàng gì chơi trên đầu trên cổ người_ta trường to đẹp như vậy_mà chỉ 1 người có khả_năng đưa bằng người đó tới trễ gọi ko nge máy là coi như trường ko làm được gì cả
"Có quay lại trường xin giấy tờ, thấy thái độ bảo vệ hơi xuống cấp, không như trước.",0,có quay lại trường xin giấy tờ thấy thái độ bảo vệ hơi xuống cấp không như trước,có quay lại trường xin giấy tờ thấy thái độ bảo vệ hơi xuống cấp không như trước,"['có', 'quay', 'lại', 'trường', 'xin', 'giấy_tờ', 'thấy', 'thái_độ', 'bảo_vệ', 'hơi', 'xuống_cấp', 'không', 'như', 'trước']",có quay lại trường xin giấy_tờ thấy thái_độ bảo_vệ hơi xuống_cấp không như trước
"Trường học mà cứ tưởng đi sự kiện, âm nhạc lá chính, tiếng thầy cô là nền.",0,trường học mà cứ tưởng đi sự kiện âm nhạc lá chính tiếng thầy cô là nền,trường học mà cứ tưởng đi sự kiện âm nhạc lá chính tiếng thầy cô là nền,"['trường_học', 'mà', 'cứ', 'tưởng', 'đi', 'sự_kiện', 'âm_nhạc', 'lá', 'chính', 'tiếng', 'thầy_cô', 'là', 'nền']",trường_học mà cứ tưởng đi sự_kiện âm_nhạc lá chính tiếng thầy_cô là nền
"Trường gì nói 1 đằng làm 1 nẻo, đợi sinh viên đăng ký môn hết rồi mới thông báo đổi địa điểm, đổi địa điểm chưa đủ đợi sinh viên thanh toán học phí rồi thông báo đổi lịch thi, từ Gò Vấp dời ra Nhà Bè. Hotline trường gọi thì không ai nghe máy, email cho bên trợ giảng củng không ai thèm rep.",0,trường gì nói 1 đằng làm 1 nẻo đợi sinh viên đăng ký môn hết rồi mới thông báo đổi địa điểm đổi địa điểm chưa đủ đợi sinh viên thanh toán học phí rồi thông báo đổi lịch thi từ gò vấp dời ra nhà bè hotline trường gọi thì không ai nghe máy email cho bên trợ giảng củng không ai thèm rep,trường gì nói 1 đằng làm 1 nẻo đợi sinh viên đăng ký môn hết rồi mới thông báo đổi địa điểm đổi địa điểm chưa đủ đợi sinh viên thanh toán học phí rồi thông báo đổi lịch thi từ gò vấp dời ra nhà bè hotline trường gọi thì không ai nghe máy email cho bên trợ giảng củng không ai thèm rep,"['trường', 'gì', 'nói', '1', 'đằng', 'làm', '1', 'nẻo', 'đợi', 'sinh_viên', 'đăng_ký', 'môn', 'hết', 'rồi', 'mới', 'thông_báo', 'đổi', 'địa_điểm', 'đổi', 'địa_điểm', 'chưa', 'đủ', 'đợi', 'sinh_viên', 'thanh_toán', 'học_phí', 'rồi', 'thông_báo', 'đổi', 'lịch', 'thi', 'từ', 'gò', 'vấp', 'dời', 'ra', 'nhà_bè', 'hotline', 'trường', 'gọi', 'thì', 'không', 'ai', 'nghe', 'máy', 'email', 'cho', 'bên', 'trợ_giảng', 'củng', 'không', 'ai', 'thèm', 'rep']",trường gì nói 1 đằng làm 1 nẻo đợi sinh_viên đăng_ký môn hết rồi mới thông_báo đổi địa_điểm đổi địa_điểm chưa đủ đợi sinh_viên thanh_toán học_phí rồi thông_báo đổi lịch thi từ gò vấp dời ra nhà_bè hotline trường gọi thì không ai nghe máy email cho bên trợ_giảng củng không ai thèm rep
"Vấn đề thứ 1 trường để số đt hotline mà gọi không bao giờ nghe!
Vấn đề thứ 2 có cơ sở dưới đồng nai mà tại sao lại bắt sv lên sài gòn thi, nếu thì ở trong tp hay gì thì ko đáng nhắc tới nhưng lại xuống tận nhà bè nơi khi ho cò gáy ko có lấy dịch vụ grab, đến địa chỉ trên grab còn ko có. Ko biết làm ăn kiểu gì hay chỉ biết lấy tiền sinh viên xong rồi thôi???
Vấn đề thứ 3 nhà trường cũng ko thèm coi đóng góp ý kiến từ sinh viên và phụ huynh của học sinh trong trường, cái cơ bản của nghề giáo là ở đâu?",0,vấn đề thứ 1 trường để số đt hotline mà gọi không bao giờ nghe vấn đề thứ 2 có cơ sở dưới đồng nai mà tại sao lại bắt sv lên sài gòn thi nếu thì ở trong tp hay gì thì ko đáng nhắc tới nhưng lại xuống tận nhà bè nơi khi ho cò gáy ko có lấy dịch vụ grab đến địa chỉ trên grab còn ko có ko biết làm ăn kiểu gì hay chỉ biết lấy tiền sinh viên xong rồi thôi vấn đề thứ 3 nhà trường cũng ko thèm coi đóng góp ý kiến từ sinh viên và phụ huynh của học sinh trong trường cái cơ bản của nghề giáo là ở đâu,vấn đề thứ 1 trường để số đt hotline mà gọi không bao giờ nghe vấn đề thứ 2 có cơ sở dưới đồng nai mà tại sao lại bắt sv lên sài gòn thi nếu thì ở trong tp hay gì thì ko đáng nhắc tới nhưng lại xuống tận nhà bè nơi khi ho cò gáy ko có lấy dịch vụ grab đến địa chỉ trên grab còn ko có ko biết làm ăn kiểu gì hay chỉ biết lấy tiền sinh viên xong rồi thôi vấn đề thứ 3 nhà trường cũng ko thèm coi đóng góp ý kiến từ sinh viên và phụ huynh của học sinh trong trường cái cơ bản của nghề giáo là ở đâu,"['vấn_đề', 'thứ', '1', 'trường', 'để', 'số', 'đt', 'hotline', 'mà', 'gọi', 'không', 'bao_giờ', 'nghe', 'vấn_đề', 'thứ', '2', 'có', 'cơ_sở', 'dưới', 'đồng_nai', 'mà', 'tại_sao', 'lại', 'bắt', 'sv', 'lên', 'sài_gòn', 'thi', 'nếu', 'thì', 'ở', 'trong', 'tp', 'hay', 'gì', 'thì', 'ko', 'đáng', 'nhắc', 'tới', 'nhưng', 'lại', 'xuống', 'tận', 'nhà_bè', 'nơi', 'khi', 'ho', 'cò', 'gáy', 'ko', 'có', 'lấy', 'dịch_vụ', 'grab', 'đến', 'địa_chỉ', 'trên', 'grab', 'còn', 'ko', 'có', 'ko', 'biết', 'làm_ăn', 'kiểu', 'gì', 'hay', 'chỉ', 'biết', 'lấy', 'tiền', 'sinh_viên', 'xong', 'rồi', 'thôi', 'vấn_đề', 'thứ', '3', 'nhà_trường', 'cũng', 'ko', 'thèm', 'coi', 'đóng_góp_ý_kiến', 'từ', 'sinh_viên', 'và', 'phụ_huynh', 'của', 'học_sinh', 'trong', 'trường', 'cái', 'cơ_bản', 'của', 'nghề', 'giáo', 'là', 'ở', 'đâu']",vấn_đề thứ 1 trường để số đt hotline mà gọi không bao_giờ nghe vấn_đề thứ 2 có cơ_sở dưới đồng_nai mà tại_sao lại bắt sv lên sài_gòn thi nếu thì ở trong tp hay gì thì ko đáng nhắc tới nhưng lại xuống tận nhà_bè nơi khi ho cò gáy ko có lấy dịch_vụ grab đến địa_chỉ trên grab còn ko có ko biết làm_ăn kiểu gì hay chỉ biết lấy tiền sinh_viên xong rồi thôi vấn_đề thứ 3 nhà_trường cũng ko thèm coi đóng_góp_ý_kiến từ sinh_viên và phụ_huynh của học_sinh trong trường cái cơ_bản của nghề giáo là ở đâu
"Xử lý vấn đề cho sinh viên quá tệ. Thật sự ko tốt, hiệu quả như những gì nhà trường truyền thông",0,xử lý vấn đề cho sinh viên quá tệ thật sự ko tốt hiệu quả như những gì nhà trường truyền thông,xử lý vấn đề cho sinh viên quá tệ thật sự ko tốt hiệu quả như những gì nhà trường truyền thông,"['xử_lý', 'vấn_đề', 'cho', 'sinh_viên', 'quá', 'tệ', 'thật_sự', 'ko', 'tốt', 'hiệu_quả', 'như', 'những', 'gì', 'nhà_trường', 'truyền_thông']",xử_lý vấn_đề cho sinh_viên quá tệ thật_sự ko tốt hiệu_quả như những gì nhà_trường truyền_thông
"Giải quyết vấn đề thiếu chuyên nghiệp, làm trễ nãi việc học của sinh viên",0,giải quyết vấn đề thiếu chuyên nghiệp làm trễ nãi việc học của sinh viên,giải quyết vấn đề thiếu chuyên nghiệp làm trễ nãi việc học của sinh viên,"['giải_quyết', 'vấn_đề', 'thiếu', 'chuyên_nghiệp', 'làm', 'trễ', 'nãi', 'việc', 'học', 'của', 'sinh_viên']",giải_quyết vấn_đề thiếu chuyên_nghiệp làm trễ nãi việc học của sinh_viên
Mặc dù có nhiều điểm cần cải thiện nhưng đây vẫn là ngôi trường mình chọn học trong 3 năm qua. Mãi iu OU 💙🫶🏻,1,mặc dù có nhiều điểm cần cải thiện nhưng đây vẫn là ngôi trường mình chọn học trong 3 năm qua mãi iu ou,mặc dù có nhiều điểm cần cải thiện nhưng đây vẫn là ngôi trường mình chọn học trong 3 năm qua mãi iu ou,"['mặc_dù', 'có', 'nhiều', 'điểm', 'cần', 'cải_thiện', 'nhưng', 'đây', 'vẫn', 'là', 'ngôi', 'trường', 'mình', 'chọn', 'học', 'trong', '3', 'năm', 'qua', 'mãi', 'iu', 'ou']",mặc_dù có nhiều điểm cần cải_thiện nhưng đây vẫn là ngôi trường mình chọn học trong 3 năm qua mãi iu ou
Tuyển sinh một nơi cho học một ngã. Thông tin không rõ ràng. Làm trễ nãi tương lai của nhiều người vì sự vô đạo đức của trường.,0,tuyển sinh một nơi cho học một ngã thông tin không rõ ràng làm trễ nãi tương lai của nhiều người vì sự vô đạo đức của trường,tuyển sinh một nơi cho học một ngã thông tin không rõ ràng làm trễ nãi tương lai của nhiều người vì sự vô đạo đức của trường,"['tuyển_sinh', 'một', 'nơi', 'cho', 'học', 'một', 'ngã', 'thông_tin', 'không', 'rõ_ràng', 'làm', 'trễ', 'nãi', 'tương_lai', 'của', 'nhiều', 'người', 'vì', 'sự', 'vô_đạo_đức', 'của', 'trường']",tuyển_sinh một nơi cho học một ngã thông_tin không rõ_ràng làm trễ nãi tương_lai của nhiều người vì sự vô_đạo_đức của trường
"Trường lừa đảo tân sinh viên, rồi mở giọng văn thông cảm. Trường dạy đa ngành mà tưởng đâu đa cấp lừa đảo các em sinh viên. Mọi người đừng cho con em vào trường này tuy chất lượng giảng dạy ở mức khá nhưng cái tâm làm giáo dục không khác gì lừa đảo",0,trường lừa đảo tân sinh viên rồi mở giọng văn thông cảm trường dạy đa ngành mà tưởng đâu đa cấp lừa đảo các em sinh viên mọi người đừng cho con em vào trường này tuy chất lượng giảng dạy ở mức khá nhưng cái tâm làm giáo dục không khác gì lừa đảo,trường lừa đảo tân sinh viên rồi mở giọng văn thông cảm trường dạy đa ngành mà tưởng đâu đa cấp lừa đảo các em sinh viên mọi người đừng cho con em vào trường này tuy chất lượng giảng dạy ở mức khá nhưng cái tâm làm giáo dục không khác gì lừa đảo,"['trường', 'lừa_đảo', 'tân_sinh_viên', 'rồi', 'mở', 'giọng', 'văn', 'thông_cảm', 'trường', 'dạy', 'đa', 'ngành', 'mà', 'tưởng', 'đâu', 'đa_cấp', 'lừa_đảo', 'các', 'em', 'sinh_viên', 'mọi', 'người', 'đừng', 'cho', 'con_em', 'vào', 'trường', 'này', 'tuy', 'chất_lượng', 'giảng_dạy', 'ở', 'mức', 'khá', 'nhưng', 'cái', 'tâm', 'làm', 'giáo_dục', 'không', 'khác', 'gì', 'lừa_đảo']",trường lừa_đảo tân_sinh_viên rồi mở giọng văn thông_cảm trường dạy đa ngành mà tưởng đâu đa_cấp lừa_đảo các em sinh_viên mọi người đừng cho con_em vào trường này tuy chất_lượng giảng_dạy ở mức khá nhưng cái tâm làm giáo_dục không khác gì lừa_đảo
