Comment ,Label,1_Comment,2_Comment,tokens,sent_tokens
"Cơ sở vật chất hiện đại, phòng lab xịn xò, sinh viên học tập thoải mái. Điểm cộng lớn! 💖",1,cơ sở vật chất hiện đại phòng lab xịn xò sinh viên học tập thoải mái điểm cộng lớn,cơ sở vật chất hiện đại phòng lab xịn xò sinh viên học tập thoải mái điểm cộng lớn,"['cơ_sở', 'vật_chất', 'hiện_đại', 'phòng', 'lab', 'xịn_xò', 'sinh_viên', 'học_tập', 'thoải_mái', 'điểm', 'cộng', 'lớn']",cơ_sở vật_chất hiện_đại phòng lab xịn_xò sinh_viên học_tập thoải_mái điểm cộng lớn
"Chương trình học đa dạng, có nhiều hoạt động ngoại khóa thú vị. Ai cũng nên thử! 🎉",1,chương trình học đa dạng có nhiều hoạt động ngoại khóa thú vị ai cũng nên thử,chương trình học đa dạng có nhiều hoạt động ngoại khóa thú vị ai cũng nên thử,"['chương_trình', 'học', 'đa_dạng', 'có', 'nhiều', 'hoạt_động', 'ngoại', 'khóa', 'thú_vị', 'ai', 'cũng', 'nên', 'thử']",chương_trình học đa_dạng có nhiều hoạt_động ngoại khóa thú_vị ai cũng nên thử
"Trường có đội ngũ giảng viên chất lượng, nhiệt tình và tâm huyết. Học mà như chơi! 😄",1,trường có đội ngũ giảng viên chất lượng nhiệt tình và tâm huyết học mà như chơi,trường có đội ngũ giảng viên chất lượng nhiệt tình và tâm huyết học mà như chơi,"['trường', 'có', 'đội_ngũ', 'giảng_viên', 'chất_lượng', 'nhiệt_tình', 'và', 'tâm_huyết_học', 'mà', 'như_chơi']",trường có đội_ngũ giảng_viên chất_lượng nhiệt_tình và tâm_huyết_học mà như_chơi
"Thư viện rộng rãi, đầy đủ tài liệu, giúp sv dễ dàng tìm hiểu kiến thức. 👍",1,thư viện rộng rãi đầy đủ tài liệu giúp sv dễ dàng tìm hiểu kiến thức,thư viện rộng rãi đầy đủ tài liệu giúp sv dễ dàng tìm hiểu kiến thức,"['thư_viện', 'rộng_rãi', 'đầy_đủ', 'tài_liệu', 'giúp', 'sv', 'dễ_dàng', 'tìm_hiểu', 'kiến_thức']",thư_viện rộng_rãi đầy_đủ tài_liệu giúp sv dễ_dàng tìm_hiểu kiến_thức
"Môi trường học tập rất thân thiện, sinh viên ai cũng vui vẻ, dễ kết bạn. Thích ghê! 🥰",1,môi trường học tập rất thân thiện sinh viên ai cũng vui vẻ dễ kết bạn thích ghê,môi trường học tập rất thân thiện sinh viên ai cũng vui vẻ dễ kết bạn thích ghê,"['môi_trường_học_tập', 'rất', 'thân_thiện', 'sinh_viên', 'ai', 'cũng', 'vui_vẻ', 'dễ', 'kết_bạn', 'thích', 'ghê']",môi_trường_học_tập rất thân_thiện sinh_viên ai cũng vui_vẻ dễ kết_bạn thích ghê
"Học phí hợp lý so với chất lượng, đáng đồng tiền bát gạo! Mọi người nên tham khảo! 😉",1,học phí hợp lý so với chất lượng đáng đồng tiền bát gạo mọi người nên tham khảo,học phí hợp lý so với chất lượng đáng đồng tiền bát gạo mọi người nên tham khảo,"['học_phí', 'hợp_lý', 'so', 'với', 'chất_lượng', 'đáng', 'đồng_tiền', 'bát', 'gạo', 'mọi', 'người', 'nên', 'tham_khảo']",học_phí hợp_lý so với chất_lượng đáng đồng_tiền bát gạo mọi người nên tham_khảo
"Cảm giác học ở đây rất thoải mái, không áp lực, thầy cô luôn tạo không khí vui vẻ. 💕",1,cảm giác học ở đây rất thoải mái không áp lực thầy cô luôn tạo không khí vui vẻ,cảm giác học ở đây rất thoải mái không áp lực thầy cô luôn tạo không khí vui vẻ,"['cảm_giác', 'học', 'ở', 'đây', 'rất', 'thoải_mái', 'không', 'áp_lực', 'thầy_cô', 'luôn', 'tạo', 'không_khí', 'vui_vẻ']",cảm_giác học ở đây rất thoải_mái không áp_lực thầy_cô luôn tạo không_khí vui_vẻ
"Hoạt động câu lạc bộ sôi nổi, dễ dàng tham gia và phát triển bản thân. Rất đáng thử! 🌟",1,hoạt động câu lạc bộ sôi nổi dễ dàng tham gia và phát triển bản thân rất đáng thử,hoạt động câu lạc bộ sôi nổi dễ dàng tham gia và phát triển bản thân rất đáng thử,"['hoạt_động', 'câu', 'lạc_bộ', 'sôi_nổi', 'dễ_dàng', 'tham_gia', 'và', 'phát_triển', 'bản_thân', 'rất', 'đáng', 'thử']",hoạt_động câu lạc_bộ sôi_nổi dễ_dàng tham_gia và phát_triển bản_thân rất đáng thử
"Trường có nhiều học bổng hấp dẫn, hỗ trợ sinh viên học tập tốt hơn. Không nên bỏ lỡ! 💸",1,trường có nhiều học bổng hấp dẫn hỗ trợ sinh viên học tập tốt hơn không nên bỏ lỡ,trường có nhiều học bổng hấp dẫn hỗ trợ sinh viên học tập tốt hơn không nên bỏ lỡ,"['trường', 'có', 'nhiều', 'học_bổng', 'hấp_dẫn', 'hỗ_trợ', 'sinh_viên', 'học_tập', 'tốt', 'hơn', 'không', 'nên', 'bỏ', 'lỡ']",trường có nhiều học_bổng hấp_dẫn hỗ_trợ sinh_viên học_tập tốt hơn không nên bỏ lỡ
"Học ở đây rất dễ tìm việc, có nhiều cơ hội việc làm sau khi tốt nghiệp. Thật sự tốt! 👏",1,học ở đây rất dễ tìm việc có nhiều cơ hội việc làm sau khi tốt nghiệp thật sự tốt,học ở đây rất dễ tìm việc có nhiều cơ hội việc làm sau khi tốt nghiệp thật sự tốt,"['học', 'ở', 'đây', 'rất', 'dễ', 'tìm', 'việc', 'có', 'nhiều', 'cơ_hội', 'việc_làm', 'sau', 'khi', 'tốt_nghiệp', 'thật_sự', 'tốt']",học ở đây rất dễ tìm việc có nhiều cơ_hội việc_làm sau khi tốt_nghiệp thật_sự tốt
"Học xong thấy mình trưởng thành hơn rất nhiều, tự tin vào bản thân hơn! 💪",1,học xong thấy mình trưởng thành hơn rất nhiều tự tin vào bản thân hơn,học xong thấy mình trưởng thành hơn rất nhiều tự tin vào bản thân hơn,"['học', 'xong', 'thấy', 'mình', 'trưởng_thành', 'hơn', 'rất', 'nhiều', 'tự_tin', 'vào', 'bản_thân', 'hơn']",học xong thấy mình trưởng_thành hơn rất nhiều tự_tin vào bản_thân hơn
"Trường rất chú trọng đến thực tập, tạo điều kiện cho sv trải nghiệm thực tế. 👍",1,trường rất chú trọng đến thực tập tạo điều kiện cho sv trải nghiệm thực tế,trường rất chú trọng đến thực tập tạo điều kiện cho sv trải nghiệm thực tế,"['trường', 'rất', 'chú_trọng', 'đến', 'thực_tập', 'tạo', 'điều_kiện', 'cho', 'sv', 'trải', 'nghiệm', 'thực_tế']",trường rất chú_trọng đến thực_tập tạo điều_kiện cho sv trải nghiệm thực_tế
"Đội ngũ cán bộ tư vấn tận tình, giúp sinh viên chọn ngành học phù hợp. Giúp ích ghê! 😘",1,đội ngũ cán bộ tư vấn tận tình giúp sinh viên chọn ngành học phù hợp giúp ích ghê,đội ngũ cán bộ tư vấn tận tình giúp sinh viên chọn ngành học phù hợp giúp ích ghê,"['đội_ngũ', 'cán_bộ', 'tư_vấn', 'tận_tình', 'giúp', 'sinh_viên', 'chọn', 'ngành', 'học', 'phù_hợp', 'giúp_ích', 'ghê']",đội_ngũ cán_bộ tư_vấn tận_tình giúp sinh_viên chọn ngành học phù_hợp giúp_ích ghê
"Có nhiều chương trình giao lưu với các trường khác, mở rộng kiến thức và mối quan hệ. 🤝",1,có nhiều chương trình giao lưu với các trường khác mở rộng kiến thức và mối quan hệ,có nhiều chương trình giao lưu với các trường khác mở rộng kiến thức và mối quan hệ,"['có', 'nhiều', 'chương_trình', 'giao_lưu', 'với', 'các', 'trường', 'khác', 'mở_rộng', 'kiến_thức', 'và', 'mối', 'quan_hệ']",có nhiều chương_trình giao_lưu với các trường khác mở_rộng kiến_thức và mối quan_hệ
"Sinh viên được khuyến khích sáng tạo, nhiều dự án thú vị để tham gia. Thích quá đi! 🥳",1,sinh viên được khuyến khích sáng tạo nhiều dự án thú vị để tham gia thích quá đi,sinh viên được khuyến khích sáng tạo nhiều dự án thú vị để tham gia thích quá đi,"['sinh_viên', 'được', 'khuyến_khích', 'sáng_tạo', 'nhiều', 'dự_án', 'thú_vị', 'để', 'tham_gia', 'thích', 'quá', 'đi']",sinh_viên được khuyến_khích sáng_tạo nhiều dự_án thú_vị để tham_gia thích quá đi
"Trường có nhiều sự kiện thú vị, tạo không khí sôi động cho sinh viên. Không thể bỏ qua! 🎊",1,trường có nhiều sự kiện thú vị tạo không khí sôi động cho sinh viên không thể bỏ qua,trường có nhiều sự kiện thú vị tạo không khí sôi động cho sinh viên không thể bỏ qua,"['trường', 'có', 'nhiều', 'sự_kiện', 'thú_vị', 'tạo', 'không_khí', 'sôi_động', 'cho', 'sinh_viên', 'không_thể', 'bỏ_qua']",trường có nhiều sự_kiện thú_vị tạo không_khí sôi_động cho sinh_viên không_thể bỏ_qua
"Thầy cô ở đây luôn động viên sinh viên, tạo động lực học tập cho mọi người. ❤️",1,thầy cô ở đây luôn động viên sinh viên tạo động lực học tập cho mọi người,thầy cô ở đây luôn động viên sinh viên tạo động lực học tập cho mọi người,"['thầy_cô', 'ở', 'đây', 'luôn', 'động_viên', 'sinh_viên', 'tạo', 'động_lực', 'học_tập', 'cho', 'mọi', 'người']",thầy_cô ở đây luôn động_viên sinh_viên tạo động_lực học_tập cho mọi người
"Học ở đây mà thấy mình như một phần của đại gia đình, rất ấm cúng! 🏡",1,học ở đây mà thấy mình như một phần của đại gia đình rất ấm cúng,học ở đây mà thấy mình như một phần của đại gia đình rất ấm cúng,"['học', 'ở', 'đây', 'mà', 'thấy', 'mình', 'như', 'một', 'phần', 'của', 'đại_gia_đình', 'rất', 'ấm_cúng']",học ở đây mà thấy mình như một phần của đại_gia_đình rất ấm_cúng
"Trường chú trọng đào tạo kỹ năng mềm, giúp sinh viên tự tin hơn khi ra trường. 🌈",1,trường chú trọng đào tạo kỹ năng mềm giúp sinh viên tự tin hơn khi ra trường,trường chú trọng đào tạo kỹ năng mềm giúp sinh viên tự tin hơn khi ra trường,"['trường', 'chú_trọng', 'đào_tạo', 'kỹ_năng', 'mềm', 'giúp', 'sinh_viên', 'tự_tin', 'hơn', 'khi', 'ra', 'trường']",trường chú_trọng đào_tạo kỹ_năng mềm giúp sinh_viên tự_tin hơn khi ra trường
"Có nhiều khóa học bổ sung, giúp sinh viên nâng cao kỹ năng chuyên môn. Rất hữu ích! 📚",1,có nhiều khóa học bổ sung giúp sinh viên nâng cao kỹ năng chuyên môn rất hữu ích,có nhiều khóa học bổ sung giúp sinh viên nâng cao kỹ năng chuyên môn rất hữu ích,"['có', 'nhiều', 'khóa', 'học', 'bổ_sung', 'giúp', 'sinh_viên', 'nâng', 'cao', 'kỹ_năng', 'chuyên_môn', 'rất', 'hữu_ích']",có nhiều khóa học bổ_sung giúp sinh_viên nâng cao kỹ_năng chuyên_môn rất hữu_ích
"Thư viện mở 24/7, thuận tiện cho sinh viên học tập mọi lúc mọi nơi! 😍",1,thư viện mở 247 thuận tiện cho sinh viên học tập mọi lúc mọi nơi,thư viện mở 247 thuận tiện cho sinh viên học tập mọi lúc mọi nơi,"['thư_viện', 'mở', '247', 'thuận_tiện', 'cho', 'sinh_viên', 'học_tập', 'mọi', 'lúc', 'mọi', 'nơi']",thư_viện mở 247 thuận_tiện cho sinh_viên học_tập mọi lúc mọi nơi
"Học ở đây là một trải nghiệm tuyệt vời, đáng nhớ trong cuộc đời sinh viên. 🌍",1,học ở đây là một trải nghiệm tuyệt vời đáng nhớ trong cuộc đời sinh viên,học ở đây là một trải nghiệm tuyệt vời đáng nhớ trong cuộc đời sinh viên,"['học', 'ở', 'đây', 'là', 'một', 'trải', 'nghiệm', 'tuyệt_vời', 'đáng', 'nhớ', 'trong', 'cuộc_đời', 'sinh_viên']",học ở đây là một trải nghiệm tuyệt_vời đáng nhớ trong cuộc_đời sinh_viên
Trường có nhiều trang thiết bị hiện đại hỗ trợ sinh viên học tập hiệu quả hơn. 🔧,1,trường có nhiều trang thiết bị hiện đại hỗ trợ sinh viên học tập hiệu quả hơn,trường có nhiều trang thiết bị hiện đại hỗ trợ sinh viên học tập hiệu quả hơn,"['trường', 'có', 'nhiều', 'trang', 'thiết_bị', 'hiện_đại', 'hỗ_trợ', 'sinh_viên', 'học_tập', 'hiệu_quả', 'hơn']",trường có nhiều trang thiết_bị hiện_đại hỗ_trợ sinh_viên học_tập hiệu_quả hơn
"Cảm giác như mỗi ngày đều có điều mới mẻ để học hỏi, không bao giờ nhàm chán! 😆",1,cảm giác như mỗi ngày đều có điều mới mẻ để học hỏi không bao giờ nhàm chán,cảm giác như mỗi ngày đều có điều mới mẻ để học hỏi không bao giờ nhàm chán,"['cảm_giác', 'như', 'mỗi', 'ngày', 'đều', 'có_điều', 'mới_mẻ', 'để', 'học_hỏi', 'không', 'bao_giờ', 'nhàm_chán']",cảm_giác như mỗi ngày đều có_điều mới_mẻ để học_hỏi không bao_giờ nhàm_chán
Chất lượng đào tạo ở đây xứng đáng nhận được những lời khen ngợi nhất! 🌟,1,chất lượng đào tạo ở đây xứng đáng nhận được những lời khen ngợi nhất,chất lượng đào tạo ở đây xứng đáng nhận được những lời khen ngợi nhất,"['chất_lượng', 'đào_tạo', 'ở', 'đây', 'xứng_đáng', 'nhận', 'được', 'những', 'lời', 'khen_ngợi', 'nhất']",chất_lượng đào_tạo ở đây xứng_đáng nhận được những lời khen_ngợi nhất
"Chất lượng đào tạo số 1 Việt Nam, rất là yêu trường luôn á 🥰",1,chất lượng đào tạo số 1 việt nam rất là yêu trường luôn á,chất lượng đào tạo số 1 việt nam rất là yêu trường luôn á,"['chất_lượng', 'đào_tạo', 'số', '1', 'việt_nam', 'rất', 'là', 'yêu', 'trường', 'luôn', 'á']",chất_lượng đào_tạo số 1 việt_nam rất là yêu trường luôn á
"Không gian lớp học đỉnh cao, thoáng mát, sinh viên tự giác, giảng viên thì thoải mái. đỉnh thật sự",1,không gian lớp học đỉnh cao thoáng mát sinh viên tự giác giảng viên thì thoải mái đỉnh thật sự,không gian lớp học đỉnh cao thoáng mát sinh viên tự giác giảng viên thì thoải mái đỉnh thật sự,"['không_gian', 'lớp_học', 'đỉnh_cao', 'thoáng', 'mát', 'sinh_viên', 'tự_giác', 'giảng_viên', 'thì', 'thoải_mái', 'đỉnh', 'thật_sự']",không_gian lớp_học đỉnh_cao thoáng mát sinh_viên tự_giác giảng_viên thì thoải_mái đỉnh thật_sự
"Dù phải chạy cơ sở, nhưng trường cung cấp hệ thống bus rất tiện lợi luôn í. Rẻ mà xe rất mát và xịn như xe du lịch vậy",1,dù phải chạy cơ sở nhưng trường cung cấp hệ thống bus rất tiện lợi luôn í rẻ mà xe rất mát và xịn như xe du lịch vậy,dù phải chạy cơ sở nhưng trường cung cấp hệ thống bus rất tiện lợi luôn í rẻ mà xe rất mát và xịn như xe du lịch vậy,"['dù', 'phải', 'chạy', 'cơ_sở', 'nhưng', 'trường', 'cung_cấp', 'hệ_thống', 'bus', 'rất', 'tiện_lợi', 'luôn', 'í', 'rẻ', 'mà', 'xe', 'rất', 'mát', 'và', 'xịn', 'như', 'xe', 'du_lịch_vậy']",dù phải chạy cơ_sở nhưng trường cung_cấp hệ_thống bus rất tiện_lợi luôn í rẻ mà xe rất mát và xịn như xe du_lịch_vậy
"Sinh viên ở đây tự giác và rất văn minh, có lẽ là trường top VN nên cảm giác rất xứng đáng 😍",1,sinh viên ở đây tự giác và rất văn minh có lẽ là trường top vn nên cảm giác rất xứng đáng,sinh viên ở đây tự giác và rất văn minh có lẽ là trường top vn nên cảm giác rất xứng đáng,"['sinh_viên', 'ở', 'đây', 'tự_giác', 'và', 'rất', 'văn_minh', 'có_lẽ', 'là', 'trường', 'top', 'vn', 'nên', 'cảm_giác', 'rất', 'xứng_đáng']",sinh_viên ở đây tự_giác và rất văn_minh có_lẽ là trường top vn nên cảm_giác rất xứng_đáng
Mọi thứ đều ok nhưng học phí đắt quá ạ 😭,0,mọi thứ đều ok nhưng học phí đắt quá ạ,mọi thứ đều ok nhưng học phí đắt quá ạ,"['mọi', 'thứ', 'đều', 'ok', 'nhưng', 'học_phí', 'đắt', 'quá', 'ạ']",mọi thứ đều ok nhưng học_phí đắt quá ạ
Đồ ăn căn tin không được ngon 😀,0,đồ ăn căn tin không được ngon,đồ ăn căn tin không được ngon,"['đồ', 'ăn', 'căn', 'tin', 'không', 'được', 'ngon']",đồ ăn căn tin không được ngon
"Không gian trường xanh, và nhiều chỗ ngồi. Rất thích 🤩",1,không gian trường xanh và nhiều chỗ ngồi rất thích,không gian trường xanh và nhiều chỗ ngồi rất thích,"['không_gian', 'trường', 'xanh', 'và', 'nhiều', 'chỗ', 'ngồi', 'rất', 'thích']",không_gian trường xanh và nhiều chỗ ngồi rất thích
"Giảng viên đa số rất nhiệt tình, trình độ chuyên môn rất cao và luôn hỗ trợ sinh viên hết sức 🥰",1,giảng viên đa số rất nhiệt tình trình độ chuyên môn rất cao và luôn hỗ trợ sinh viên hết sức,giảng viên đa số rất nhiệt tình trình độ chuyên môn rất cao và luôn hỗ trợ sinh viên hết sức,"['giảng_viên', 'đa_số', 'rất', 'nhiệt_tình', 'trình_độ', 'chuyên_môn', 'rất', 'cao', 'và', 'luôn', 'hỗ_trợ', 'sinh_viên', 'hết_sức']",giảng_viên đa_số rất nhiệt_tình trình_độ chuyên_môn rất cao và luôn hỗ_trợ sinh_viên hết_sức
"Các môn học trong ngành được thiết kế rất hợp lý, cảm giác được vận dụng triệt để những gì đã được học",1,các môn học trong ngành được thiết kế rất hợp lý cảm giác được vận dụng triệt để những gì đã được học,các môn học trong ngành được thiết kế rất hợp lý cảm giác được vận dụng triệt để những gì đã được học,"['các', 'môn_học', 'trong', 'ngành', 'được', 'thiết_kế', 'rất', 'hợp_lý', 'cảm_giác', 'được', 'vận_dụng', 'triệt_để', 'những', 'gì', 'đã', 'được', 'học']",các môn_học trong ngành được thiết_kế rất hợp_lý cảm_giác được vận_dụng triệt_để những gì đã được học
"Mấy chú lái xe bus lái ẩu, đồ ăn căn tin thì dở, cảm giác các hệ clc và đại trà bị phân biệt đối xử",0,mấy chú lái xe bus lái ẩu đồ ăn căn tin thì dở cảm giác các hệ clc và đại trà bị phân biệt đối xử,mấy chú lái xe bus lái ẩu đồ ăn căn tin thì dở cảm giác các hệ clc và đại trà bị phân biệt đối xử,"['mấy', 'chú', 'lái_xe', 'bus', 'lái', 'ẩu', 'đồ', 'ăn', 'căn', 'tin', 'thì', 'dở', 'cảm_giác', 'các', 'hệ', 'clc', 'và', 'đại_trà', 'bị', 'phân_biệt', 'đối_xử']",mấy chú lái_xe bus lái ẩu đồ ăn căn tin thì dở cảm_giác các hệ clc và đại_trà bị phân_biệt đối_xử
"Chất lượng giảng dạy thì ok nhưng vẫn là trường công, vì vậy học phí hiện tại thì hơi đắt",0,chất lượng giảng dạy thì ok nhưng vẫn là trường công vì vậy học phí hiện tại thì hơi đắt,chất lượng giảng dạy thì ok nhưng vẫn là trường công vì vậy học phí hiện tại thì hơi đắt,"['chất_lượng', 'giảng_dạy', 'thì', 'ok', 'nhưng', 'vẫn', 'là', 'trường', 'công', 'vì_vậy', 'học_phí', 'hiện_tại', 'thì', 'hơi', 'đắt']",chất_lượng giảng_dạy thì ok nhưng vẫn là trường công vì_vậy học_phí hiện_tại thì hơi đắt
"Cảm giác chương trình học nặng, đề kiểm tra khó, mà lại là ngành kinh tế. Thiếu thực tiễn",0,cảm giác chương trình học nặng đề kiểm tra khó mà lại là ngành kinh tế thiếu thực tiễn,cảm giác chương trình học nặng đề kiểm tra khó mà lại là ngành kinh tế thiếu thực tiễn,"['cảm_giác', 'chương_trình', 'học', 'nặng', 'đề', 'kiểm_tra', 'khó', 'mà_lại', 'là', 'ngành', 'kinh_tế', 'thiếu', 'thực_tiễn']",cảm_giác chương_trình học nặng đề kiểm_tra khó mà_lại là ngành kinh_tế thiếu thực_tiễn
"Chỗ gửi xe thì nhanh hết, cơ sở số 2 thì rất chật chội. Đi học cảm giác khó chịu",0,chỗ gửi xe thì nhanh hết cơ sở số 2 thì rất chật chội đi học cảm giác khó chịu,chỗ gửi xe thì nhanh hết cơ sở số 2 thì rất chật chội đi học cảm giác khó chịu,"['chỗ', 'gửi', 'xe', 'thì', 'nhanh', 'hết', 'cơ_sở', 'số', '2', 'thì', 'rất', 'chật_chội', 'đi', 'học', 'cảm_giác', 'khó_chịu']",chỗ gửi xe thì nhanh hết cơ_sở số 2 thì rất chật_chội đi học cảm_giác khó_chịu
"Không hiểu sao tự nhiên cứ đến trễ một xíu lại phải gửi xe ở ngoài vì bãi xe hết chỗ, có cách nào cải thiện hong chứ đi học kiểu này gửi xe ở ngoài riết hết tiền",0,không hiểu sao tự nhiên cứ đến trễ một xíu lại phải gửi xe ở ngoài vì bãi xe hết chỗ có cách nào cải thiện hong chứ đi học kiểu này gửi xe ở ngoài riết hết tiền,không hiểu sao tự nhiên cứ đến trễ một xíu lại phải gửi xe ở ngoài vì bãi xe hết chỗ có cách nào cải thiện hong chứ đi học kiểu này gửi xe ở ngoài riết hết tiền,"['không', 'hiểu', 'sao', 'tự_nhiên', 'cứ', 'đến', 'trễ', 'một', 'xíu', 'lại', 'phải', 'gửi', 'xe', 'ở', 'ngoài', 'vì', 'bãi', 'xe', 'hết', 'chỗ', 'có', 'cách', 'nào', 'cải_thiện', 'hong', 'chứ', 'đi', 'học', 'kiểu', 'này', 'gửi', 'xe', 'ở', 'ngoài', 'riết', 'hết', 'tiền']",không hiểu sao tự_nhiên cứ đến trễ một xíu lại phải gửi xe ở ngoài vì bãi xe hết chỗ có cách nào cải_thiện hong chứ đi học kiểu này gửi xe ở ngoài riết hết tiền
Trường có các suất học bổng khuyến khích học tập mang đầy tính khích lệ. Rất thích và sẽ phấn đấu,1,trường có các suất học bổng khuyến khích học tập mang đầy tính khích lệ rất thích và sẽ phấn đấu,trường có các suất học bổng khuyến khích học tập mang đầy tính khích lệ rất thích và sẽ phấn đấu,"['trường', 'có', 'các', 'suất', 'học_bổng', 'khuyến_khích', 'học_tập', 'mang', 'đầy', 'tính', 'khích_lệ', 'rất', 'thích', 'và', 'sẽ', 'phấn_đấu']",trường có các suất học_bổng khuyến_khích học_tập mang đầy tính khích_lệ rất thích và sẽ phấn_đấu
Mỗi môn học được giảng dạy rất chi tiết,1,mỗi môn học được giảng dạy rất chi tiết,mỗi môn học được giảng dạy rất chi tiết,"['mỗi', 'môn_học', 'được', 'giảng_dạy', 'rất', 'chi_tiết']",mỗi môn_học được giảng_dạy rất chi_tiết
"Phòng học lạnh ngắt, máy chiếu thiết bị đầy đủ, thích lắm luôn",1,phòng học lạnh ngắt máy chiếu thiết bị đầy đủ thích lắm luôn,phòng học lạnh ngắt máy chiếu thiết bị đầy đủ thích lắm luôn,"['phòng', 'học', 'lạnh_ngắt', 'máy_chiếu', 'thiết_bị', 'đầy_đủ', 'thích', 'lắm', 'luôn']",phòng học lạnh_ngắt máy_chiếu thiết_bị đầy_đủ thích lắm luôn
Cảm giác được trân trọng khi học tại đây. Chuyên viên đào tạo cho đến giảng viên đều rất tôn trọng tiếng nói của sinh viên,1,cảm giác được trân trọng khi học tại đây chuyên viên đào tạo cho đến giảng viên đều rất tôn trọng tiếng nói của sinh viên,cảm giác được trân trọng khi học tại đây chuyên viên đào tạo cho đến giảng viên đều rất tôn trọng tiếng nói của sinh viên,"['cảm_giác', 'được', 'trân_trọng', 'khi', 'học', 'tại', 'đây', 'chuyên_viên', 'đào_tạo', 'cho', 'đến', 'giảng_viên', 'đều', 'rất', 'tôn_trọng', 'tiếng_nói', 'của', 'sinh_viên']",cảm_giác được trân_trọng khi học tại đây chuyên_viên đào_tạo cho đến giảng_viên đều rất tôn_trọng tiếng_nói của sinh_viên
